{
  "run_id": "fixture_json_run_001",
  "model_id": "fixture-model-json",
  "provider": "Fixture Provider",
  "model_name": "Fixture JSON Model",
  "model_version": "1.0",
  "run_date": "2026-06-18",
  "operator": "fixture-operator",
  "input_packet_id": "stage4m_d45620cd10dd4be1",
  "input_packet_hash": "eeee9ecdc2f9ff04b8e07fcea415f25d56926f35c34a4f7365ba6e12813a3c04",
  "prompt_hash": "999f4947f7bcd23fb3872101840c1bb442e13f54ead6db6d1494bac7c827b6fb",
  "temperature": 0,
  "notes": "Canonical valid JSON ingestion fixture.",
  "items": [
    {
      "task_type": "sentence_identification",
      "doc_id": "doc_001",
      "sentence_id": "doc_001_s01_p01_s01",
      "span_id": "stage4m_unit_00001",
      "metaphor_present": "no",
      "lexical_unit": null,
      "lexical_unit_start": null,
      "lexical_unit_end": null,
      "source_domain": null,
      "target_domain": null,
      "cluster_id": null,
      "koenigsberg_function": null,
      "violence_logic": null,
      "obligatory_frame": null,
      "agency_or_absence_flag": null,
      "confidence": "medium",
      "ambiguity_flag": "no",
      "rival_reading": null,
      "justification": "No metaphor-related lexical unit was identified."
    },
    {
      "task_type": "field_agreement",
      "doc_id": "doc_001",
      "sentence_id": "doc_001_s01_p02_s03",
      "span_id": "stage4m_unit_00056",
      "metaphor_present": "yes",
      "lexical_unit": "the legal inheritors of these fundamental blessings",
      "lexical_unit_start": null,
      "lexical_unit_end": null,
      "source_domain": "inheritance",
      "target_domain": "civil liberty",
      "cluster_id": "cluster_05_fathers_inheritance",
      "koenigsberg_function": "ancestral_debt",
      "violence_logic": "obligatory",
      "obligatory_frame": "Inheritance creates a duty to preserve the founders' legacy.",
      "agency_or_absence_flag": null,
      "confidence": "high",
      "ambiguity_flag": "no",
      "rival_reading": null,
      "justification": "The supplied span maps inherited legal blessings onto political obligation."
    }
  ]
}
